cluster_id,auto_label,last_log_count,extrapolated_growth_5yr,last_date
771,"display, device, display device, device display, unit",5.759,-2.506,2025-10-01
587,"surge, protector, surge protector, protection, electrical",2.996,-2.507,2025-10-01
2388,"imaging, method, imaging method, methods, imaging imaging",3.258,-2.51,2025-10-01
2416,"phase, reference, tracking, tracking reference, signal",1.792,-2.51,2025-10-01
1212,"battery, electrolyte, secondary, secondary battery, lithium",4.06,-2.513,2025-10-01
1919,"method, manufacturing, structure, structural, structural element",2.89,-2.513,2025-10-01
458,"inventory, method, control, management, inventory management",3.807,-2.514,2025-10-01
326,"belt, conveyor, conveyor belt, method, endless",2.996,-2.515,2025-10-01
727,"humidifier, humidifier humidifier, gas, humidification humidifier, humidification",2.639,-2.518,2025-10-01
1251,"repeater, wireless, method, wireless repeater, apparatus",2.398,-2.519,2025-10-01
521,"seal, sealing, device, member, seal member",4.956,-2.519,2025-10-01
460,"vacuum, pump, vacuum pump, vacuum pumps, screw",2.565,-2.52,2025-10-01
123,"brake, device, disc, disc brake, control",5.352,-2.523,2025-10-01
1385,"cannula, use, methods, surgical, method",1.946,-2.523,2025-10-01
1531,"alert, alerts, method, systems, generating",2.89,-2.524,2025-10-01
996,"queue, method, queues, apparatus, service",2.773,-2.526,2025-10-01
2042,"vehicle, method, autonomous, vehicles, driving",3.219,-2.527,2025-10-01
459,"compression, data, method, data compression, apparatus",4.007,-2.529,2025-10-01
52,"insulation, insulating, method, material, insulated",3.638,-2.532,2025-10-01
249,"exercise, apparatus, device, exercising, method",4.522,-2.532,2025-10-01
1946,"terminal, method, apparatus, user, portable",2.398,-2.535,2025-10-01
18,"asphalt, method, apparatus, polymer, modified",2.89,-2.539,2025-10-01
1221,"printed, flexible, circuit, flexible printed, printed circuit",2.303,-2.54,2025-10-01
279,"ozone, method, water, treatment, apparatus",2.708,-2.541,2025-10-01
1368,"button, device, electronic device, electronic, assembly",2.197,-2.544,2025-10-01
566,"composition, compositions, gel, methods, gelatin",3.091,-2.547,2025-10-01
1483,"tire, rubber, composition, rubber composition, pneumatic",2.565,-2.55,2025-10-01
455,"method, decoding, encoding, coding, apparatus",4.007,-2.553,2025-10-01
825,"derivatives, substituted, use, preparation, 8242",6.094,-2.553,2025-10-01
410,"device, photoelectric, photodiode, method, photodetector",3.296,-2.553,2025-10-01
1528,"hose, fitting, method, hose fitting, low",1.792,-2.554,2025-10-01
2065,"control, device, method, control device, device control",2.565,-2.559,2025-10-01
1079,"semiconductor, semiconductor device, device, manufacturing, method",3.989,-2.563,2025-10-01
766,"stimulation, electrical, electrode, apparatus, method",4.635,-2.563,2025-10-01
655,"recording, information, apparatus, method, information recording",4.443,-2.564,2025-10-01
1472,"cell, method, communication, wireless, apparatus",3.401,-2.565,2025-10-01
1056,"capacitor, method, capacitor method, forming, structure",3.258,-2.566,2025-10-01
231,"drain, device, drainage, drain assembly, assembly",3.332,-2.566,2025-10-01
1811,"telemetry, method, systems, power, apparatus",2.639,-2.569,2025-10-01
2208,"accelerator, configurable, accelerators, systems, method",2.708,-2.57,2025-10-01
843,"relay, electromagnetic, electromagnetic relay, relay electromagnetic, relay relay",3.497,-2.571,2025-10-01
361,"inspection, method, apparatus, defect, device",4.19,-2.573,2025-10-01
338,"propulsion, boat, marine, watercraft, marine propulsion",4.159,-2.574,2025-10-01
1394,"graphene, method, nano, device, sheet",3.85,-2.579,2025-10-01
1558,"hemostatic, hemostasis, methods, compositions, devices",2.398,-2.583,2025-10-01
1373,"tactile, device, method, tactile feedback, feedback",2.89,-2.585,2025-10-01
1188,"hair, compositions, composition, growth, hair growth",4.159,-2.585,2025-10-01
1710,"carrier, aggregation, carrier aggregation, method, mobile",2.639,-2.588,2025-10-01
330,"enclosure, computer, computer enclosure, equipment, electronic",2.485,-2.588,2025-10-01
318,"grinding, apparatus, grinder, device, grinding apparatus",3.178,-2.592,2025-10-01
803,"semiconductor, contact, device, semiconductor device, method",2.565,-2.594,2025-10-01
2079,"methods, cancer, treatment, treating, compositions",3.989,-2.598,2025-10-01
494,"turbocharger, exhaust, engine, internal, gas",2.079,-2.598,2025-10-01
1324,"stator, motor, motor stator, machine, electric",3.829,-2.6,2025-10-01
939,"peptides, peptide, thereof, uses thereof, production",3.178,-2.602,2025-10-01
143,"hydraulic, device, circuit, control, vehicle",3.689,-2.606,2025-10-01
2014,"robot, arm, device, robot arm, arm robot",2.485,-2.611,2025-10-01
1388,"shelving, shelf, unit, shelving unit, shelving shelf",2.079,-2.611,2025-10-01
297,"reactor, nuclear, fuel, assembly, fuel assembly",3.401,-2.612,2025-10-01
25,"sprinkler, sprinkler sprinkler, sprinkler head, pressure, head",2.833,-2.613,2025-10-01
394,"imaging, method, apparatus, use, imaging device",2.833,-2.618,2025-10-01
2234,"landing, aircraft, vertical, vertical landing, landing aircraft",2.398,-2.618,2025-10-01
2119,"thermal, imaging, thermal imaging, image, method",2.565,-2.624,2025-10-01
1622,"harness, wire, wire harness, wiring, method",2.89,-2.626,2025-10-01
1861,"charging, vehicle, method, device, battery",4.927,-2.627,2025-10-01
444,"modulator, optical, optical modulator, optic, electro",2.708,-2.628,2025-10-01
172,"piezoelectric, method, transformer, piezoelectric transformer, device",3.784,-2.628,2025-10-01
357,"sensor, method, device, arrangement, sensor device",4.533,-2.633,2025-10-01
184,"clamp, clamping, device, clamp clamp, clamp device",4.143,-2.637,2025-10-01
2015,"weighing, weight, device, scale, device weighing",2.565,-2.64,2025-10-01
1003,"memory, method, apparatus, management, circuit",4.754,-2.643,2025-10-01
1645,"gear, planetary, planetary gear, transmission, multi",4.06,-2.644,2025-10-01
333,"lock, locking, device, locking device, lock having",4.394,-2.646,2025-10-01
149,"magnetic, sensor, field, detecting, magnetic field",4.19,-2.648,2025-10-01
1435,"access, random, random access, method, communication",4.205,-2.649,2025-10-01
1492,"cartridge, method, cartridge cartridge, cartridges, process cartridge",3.332,-2.652,2025-10-01
1379,"hash, method, hashing, apparatus, hash function",2.565,-2.653,2025-10-01
232,"analyte, method, analytes, strip, sensing",3.689,-2.658,2025-10-01
1308,"projection, apparatus, image, display, screen",3.951,-2.661,2025-10-01
949,"apparatus, electronic, electronic apparatus, apparatus electronic, device",2.89,-2.661,2025-10-01
62,"bubble, method, bubbler, device, forming",2.639,-2.661,2025-10-01
1593,"reference, method, signal, reference signal, communication",3.638,-2.663,2025-10-01
2147,"spinal, methods, method, spine, implant",4.511,-2.663,2025-10-01
1540,"power, power conversion, conversion, apparatus, conversion apparatus",3.045,-2.663,2025-10-01
1220,"surgical, instrument, surgical instrument, method, device",5.283,-2.666,2025-10-01
871,"recording, information, information recording, apparatus, medium",3.401,-2.67,2025-10-01
203,"wrench, ratchet, ratchet wrench, adjustable, having",2.639,-2.67,2025-10-01
271,"chuck, electrostatic, electrostatic chuck, method, drill",3.135,-2.671,2025-10-01
434,"laser, method, semiconductor, semiconductor laser, device",5.088,-2.671,2025-10-01
1260,"flash, memory, flash memory, method, device",3.296,-2.679,2025-10-01
1860,"wireless, charging, wireless charging, device, apparatus",3.892,-2.68,2025-10-01
1600,"electronic, electronic component, component, component electronic, device electronic",2.485,-2.681,2025-10-01
2294,"microservices, microservice, using, service, application",2.833,-2.683,2025-10-01
979,"face, method, facial, detection, methods",3.784,-2.685,2025-10-01
2341,"pressure, wound, negative pressure, negative, pressure wound",2.708,-2.69,2025-10-01
453,"camera, stereoscopic, image, apparatus, method",4.078,-2.695,2025-10-01
1543,"ramp, ramp ramp, assembly, ramp assembly, method",2.079,-2.696,2025-10-01
2232,"incident, management, response, incident response, systems",1.386,-2.698,2025-10-01
1291,"appliance, method, control, operating, household",2.944,-2.699,2025-10-01
2332,"imaging, control, method, apparatus, control method",3.045,-2.699,2025-10-01
334,"hinge, hinge hinge, assembly, hinge assembly, device",3.892,-2.708,2025-10-01
99,"mass, spectrometer, mass spectrometer, time, mass spectrometry",3.611,-2.709,2025-10-01
635,"foam, foams, polyurethane, process, polyurethane foams",4.007,-2.712,2025-10-01
691,"memory, magnetic, random access, random, access",2.639,-2.715,2025-10-01
994,"load, balancing, load balancing, method, server",2.398,-2.717,2025-10-01
775,"optical, method, apparatus, measuring, sensor",3.912,-2.718,2025-10-01
1408,"saddle, vehicle, type, type vehicle, saddle riding",2.398,-2.722,2025-10-01
606,"bonding, method, wire, apparatus, bonding method",3.761,-2.723,2025-10-01
1034,"speech, recognition, speech recognition, method, apparatus",5.268,-2.723,2025-10-01
623,"nitride, semiconductor, method, nitride semiconductor, device",3.497,-2.723,2025-10-01
1318,"dryer, clothes, clothes dryer, method, apparatus",2.079,-2.723,2025-10-01
1409,"firmware, method, update, device, firmware update",3.434,-2.725,2025-10-01
2036,"thrombus, thrombectomy, device, methods, removal",3.045,-2.726,2025-10-01
1054,"grip, gripping, method, hand, gripper method",3.689,-2.728,2025-10-01
491,"detergent, composition, compositions, detergent composition, detergent compositions",2.639,-2.73,2025-10-01
947,"golf, golf club, club, head, club head",2.197,-2.734,2025-10-01
217,"valve, heart, heart valve, method, prosthesis",4.29,-2.734,2025-10-01
962,"media, multimedia, method, content, systems",3.434,-2.735,2025-10-01
360,"distance, measuring, apparatus, distance measuring, method",3.091,-2.736,2025-10-01
1614,"method, emotion, affective, user, response",2.079,-2.736,2025-10-01
243,"blood, dialysis, collection, method, blood collection",3.296,-2.737,2025-10-01
1950,"vehicle, alert, notification, method, warning",2.944,-2.738,2025-10-01
465,"method, suppression, protection, extinguishing, prevention suppression",4.043,-2.738,2025-10-01
1384,"map, display, method, map display, apparatus",3.526,-2.741,2025-10-01
1957,"metal, organic, metal organic, organic frameworks, frameworks",2.639,-2.741,2025-10-01
1577,"cell, culture, cell culture, method, methods",3.497,-2.741,2025-10-01
777,"apparatus, image, heating, heating apparatus, image forming",2.485,-2.744,2025-10-01
1546,"data, data center, center, method, centers",2.708,-2.75,2025-10-01
1507,"image, display, apparatus, image display, method",2.833,-2.75,2025-10-01
185,"shower, shower head, device, head, tub",3.367,-2.75,2025-10-01
2146,"brain, method, activity, eeg, based",3.258,-2.751,2025-10-01
1228,"device, method, management, device management, interoperability",2.303,-2.754,2025-10-01
1709,"process, acid, carboxylic, acids, producing",2.485,-2.754,2025-10-01
1074,"certificate, method, certificates, digital, revocation",2.89,-2.757,2025-10-01
57,"method, sampling, sample, apparatus, apparatus method",3.664,-2.757,2025-10-01
510,"engine, combustion, internal combustion, internal, method",3.638,-2.757,2025-10-01
1984,"spectrum, lte, unlicensed, sharing, spectrum sharing",3.466,-2.759,2025-10-01
887,"organic, method, film, organic semiconductor, semiconductor",3.434,-2.759,2025-10-01
315,"probe, tip, device, self, probes",3.526,-2.761,2025-10-01
2199,"neural, network, neural network, networks, deep",4.736,-2.764,2025-10-01
423,"control, method, device, apparatus, control method",3.434,-2.766,2025-10-01
2153,"tube, method, apparatus, tube coupling, tool",3.85,-2.766,2025-10-01
1280,"vibration, method, device, vibrations, apparatus",4.078,-2.767,2025-10-01
1170,"shape, memory, shape memory, memory alloy, alloy",2.197,-2.769,2025-10-01
989,"virus, computer, method, scanning, detection",3.714,-2.77,2025-10-01
1734,"bluetooth, method, apparatus, communication, low",2.639,-2.77,2025-10-01
584,"transformer, voltage, high, method, power",3.258,-2.772,2025-10-01
1773,"location, method, device, mobile, information",3.258,-2.774,2025-10-01
1799,"tire, pressure, tire pressure, method, wheel",3.219,-2.777,2025-10-01
27,"game, method, playing, method playing, machine",5.303,-2.779,2025-10-01
481,"fabric, method, fabrics, textile, woven",4.111,-2.781,2025-10-01
637,"rubber, rubber composition, composition, process, silica",2.485,-2.781,2025-10-01
1974,"methods, virus, vaccine, thereof, uses",4.905,-2.786,2025-10-01
1520,"flow, cytometer, cytometry, flow cytometer, method",2.398,-2.788,2025-10-01
1358,"channel, quality, channel quality, method, wireless",4.19,-2.793,2025-10-01
1785,"vulnerabilities, vulnerability, computer, applications, security",2.89,-2.794,2025-10-01
1549,"display, head, mounted, mounted display, head mounted",4.078,-2.794,2025-10-01
1413,"display, device, driving, display device, method",4.554,-2.794,2025-10-01
402,"projector, light, illumination, optical, using",2.197,-2.795,2025-10-01
1895,"microneedle, array, device, microneedle array, microneedle device",2.565,-2.796,2025-10-01
1829,"head, headgear, neck, support, headwear",2.485,-2.797,2025-10-01
311,"fastening, fastener, assembly, clip, method",3.97,-2.797,2025-10-01
817,"mram, method, device, mram device, configuration",1.099,-2.798,2025-10-01
845,"vehicle, communication, method, wireless, data",3.807,-2.806,2025-10-01
214,"aerosol, device, apparatus, spray, container",4.99,-2.806,2025-10-01
570,"film, method, apparatus, forming, film forming",3.135,-2.811,2025-10-01
1934,"vapor, vaporizer, vaporization, method, device",3.871,-2.814,2025-10-01
1516,"touch, panel, display, display device, device",2.708,-2.816,2025-10-01
957,"radiation, method, treatment, therapy, radiation therapy",3.497,-2.817,2025-10-01
641,"olefin, polymerization, process, olefins, catalyst",3.219,-2.819,2025-10-01
162,"leak, method, detection, testing, leak detection",3.434,-2.821,2025-10-01
59,"method, microelectromechanical, device, micro, structures",3.555,-2.821,2025-10-01
2253,"display, brightness, device, method, display brightness",2.197,-2.821,2025-10-01
215,"method, breathing, apparatus, device, airway",3.951,-2.827,2025-10-01
891,"resonator, filter, dielectric, resonator filter, device",2.303,-2.829,2025-10-01
786,"titanium, process, dioxide, titanium dioxide, producing",2.944,-2.84,2025-10-01
2058,"proteins, insecticidal, methods, use, insect",0.0,-2.847,2025-10-01
97,"cement, method, containing, materials, cementitious",3.555,-2.848,2025-10-01
895,"calibration, method, apparatus, method apparatus, calibrating",3.892,-2.849,2025-10-01
198,"bow, archery, archery bow, arrow, sight",3.178,-2.85,2025-10-01
1364,"droplet, apparatus, liquid, liquid droplet, ejection",2.485,-2.852,2025-10-01
598,"pulse, generator, pulse generator, method, width",2.398,-2.857,2025-10-01
1325,"request, automatic repeat, repeat request, repeat, automatic",3.332,-2.861,2025-10-01
704,"memory, volatile, non volatile, non, method",3.555,-2.861,2025-10-01
1661,"vehicle, rail, rail vehicle, control, method",3.611,-2.862,2025-10-01
2018,"container, containers, security, software, method",4.094,-2.866,2025-10-01
323,"window, vehicle, vehicle window, device, apparatus",4.205,-2.867,2025-10-01
1522,"package, structure, method, package structure, package package",3.178,-2.875,2025-10-01
343,"lift, lifting, vehicle, device, lifting device",3.611,-2.876,2025-10-01
1735,"automation, method, industrial, industrial automation, control",2.773,-2.877,2025-10-01
84,"stent, stent stent, graft, stent graft, expandable",3.761,-2.878,2025-10-01
75,"curtain, inflatable, inflatable curtain, curtain inflatable, device",2.398,-2.879,2025-10-01
221,"bearing, rolling, method, rolling bearing, porous",4.369,-2.88,2025-10-01
1154,"garbage, method, collection, garbage collection, apparatus",2.565,-2.88,2025-10-01
1845,"powertrain, vehicle, method, drivetrain, vehicle powertrain",2.303,-2.881,2025-10-01
1573,"semiconductor, die, semiconductor die, method, semiconductor device",2.398,-2.881,2025-10-01
2267,"heat, transfer, heat transfer, device, transfer device",3.912,-2.891,2025-10-01
1560,"pacing, cardiac, method, ventricular, methods",2.89,-2.891,2025-10-01
1098,"drying, method, apparatus, method drying, drying apparatus",2.833,-2.891,2025-10-01
1584,"migration, data, data migration, method, migration data",1.946,-2.892,2025-10-01
1374,"fixing, device, electronic, electronic device, device fixing",2.079,-2.894,2025-10-01
528,"packaging, method, apparatus, packaging machine, machine",3.912,-2.9,2025-10-01
1391,"method, delivery, methods, shipping, apparatus",3.584,-2.911,2025-10-01
256,"nozzle, spray, spray nozzle, pistol, pistol nozzle",3.401,-2.911,2025-10-01
504,"valve, pressure, device, fluid, method",5.576,-2.912,2025-10-01
94,"mirror, assembly, rearview, rearview mirror, mirror assembly",3.714,-2.912,2025-10-01
268,"roof, vehicle, vehicle roof, method, roofing",3.951,-2.916,2025-10-01
1921,"lidar, detection, method, ranging, lidar method",4.673,-2.916,2025-10-01
1027,"check, parity, low density, parity check, low",2.303,-2.92,2025-10-01
1153,"presence, method, information, communication, based",2.708,-2.923,2025-10-01
1701,"cloud, computing, cloud computing, method, based",3.401,-2.925,2025-10-01
944,"particle, method, particles, size, apparatus",2.773,-2.928,2025-10-01
493,"intake, engine, internal combustion, internal, combustion",1.792,-2.929,2025-10-01
816,"buffer, fifo, method, data, buffers",2.079,-2.932,2025-10-01
796,"flow, fluid, control, flow control, device",5.17,-2.939,2025-10-01
1389,"maintenance, method, systems, maintenance information, information",2.639,-2.94,2025-10-01
1663,"display, flexible, flexible display, device, display device",3.714,-2.942,2025-10-01
264,"actuator, actuator actuator, linear actuator, linear, electromagnetic",3.951,-2.946,2025-10-01
462,"pump, method, device, pumps, control",4.779,-2.946,2025-10-01
1666,"dimensional, method, using, generating, model",3.497,-2.95,2025-10-01
322,"roller, fixing, device, surface, bearing",3.497,-2.95,2025-10-01
2183,"vehicle, autonomous, autonomous vehicle, driving, control",4.585,-2.954,2025-10-01
1841,"panel, method, floor, panels, manufacturing",3.466,-2.965,2025-10-01
1334,"glass, method, powder, sheet, method producing",4.533,-2.966,2025-10-01
926,"biometric, method, authentication, using, fingerprint",3.871,-2.968,2025-10-01
2398,"light, light detection, detection, method, device",2.398,-2.969,2025-10-01
345,"seat, vehicle, vehicle seat, chair, device",2.485,-2.97,2025-10-01
1241,"lens, drive, device, lens drive, actuator",3.85,-2.973,2025-10-01
507,"bag, bags, apparatus, method, backpack",3.611,-2.974,2025-10-01
1621,"bar, bus bar, bus, busbar, assembly",3.219,-2.975,2025-10-01
846,"motor, electric, electric motor, motor motor, motor electric",2.303,-2.976,2025-10-01
2136,"emitting, semiconductor, light, light emitting, semiconductor light",2.303,-2.977,2025-10-01
1235,"object, tracking, method, apparatus, detection",3.738,-2.978,2025-10-01
1276,"strain, method, stress, device, measuring",2.708,-2.981,2025-10-01
1826,"touch, method, device, apparatus, sensing",4.97,-2.982,2025-10-01
454,"equalizer, equalization, adaptive, time, method",2.773,-2.985,2025-10-01
2272,"container, method, container method, reinforced, containers",4.111,-2.985,2025-10-01
2310,"mask, respiratory, respiratory mask, respirator, air",2.89,-2.986,2025-10-01
1879,"camera, method, operation, camera method, method controlling",4.234,-2.988,2025-10-01
563,"composite, method, material, composite material, manufacturing",3.401,-2.99,2025-10-01
186,"toilet, water, device, flushing, toilet flushing",3.367,-2.993,2025-10-01
556,"sputtering, target, magnetron, sputter, process",1.946,-3.0,2025-10-01
1200,"device, display, electronic, display device, apparatus",2.079,-3.002,2025-10-01
349,"substrate, method, apparatus, processing, device",1.946,-3.002,2025-10-01
2149,"interior, vehicle, component, vehicle interior, interior component",2.303,-3.004,2025-10-01
850,"power, tool, power tool, tools, tool power",3.892,-3.009,2025-10-01
1972,"ammonia, method, exhaust, systems, liquid",2.708,-3.01,2025-10-01
1885,"ear, earphone, device, headphone, assembly",4.431,-3.012,2025-10-01
1319,"collision, vehicle, method, aircraft, avoidance",4.812,-3.013,2025-10-01
1127,"emergency, method, calls, methods, location",3.332,-3.017,2025-10-01
509,"injection, fuel, engine, fuel injection, combustion",2.89,-3.017,2025-10-01
1532,"tenant, multi, multi tenant, database, method",2.485,-3.018,2025-10-01
197,"electronic, method, component, manufacturing, electronic component",2.197,-3.02,2025-10-01
1830,"additive, manufacturing, additive manufacturing, method, using",4.7,-3.023,2025-10-01
67,"vibration, damper, device, vibration damper, damping",4.111,-3.024,2025-10-01
293,"light, emitting, organic, light emitting, organic light",2.833,-3.028,2025-10-01
756,"microphone, speaker, microphone microphone, directional, device",3.219,-3.03,2025-10-01
1810,"display, panel, device, display panel, panel display",4.543,-3.034,2025-10-01
492,"surfactant, surfactants, compositions, acid, containing",2.485,-3.038,2025-10-01
1428,"food, apparatus, method, device, preparation",3.367,-3.04,2025-10-01
856,"toner, image, method, image forming, forming",2.485,-3.041,2025-10-01
960,"fault, arc, arc fault, circuit, interrupter",3.332,-3.044,2025-10-01
1465,"deduplication, data, method, storage, duplication",2.708,-3.047,2025-10-01
1365,"semiconductor, circuit, integrated, integrated circuit, semiconductor integrated",2.303,-3.048,2025-10-01
1947,"transdermal, delivery, therapeutic, patch, drug",3.367,-3.049,2025-10-01
658,"pharmaceutical, compositions, pharmaceutical compositions, containing, methods",3.912,-3.051,2025-10-01
216,"inhaler, inhalation, device, apparatus, metered",3.135,-3.052,2025-10-01
2081,"threat, method, cyber, security, systems",4.007,-3.055,2025-10-01
1539,"illumination, apparatus, device, method, illumination apparatus",2.398,-3.056,2025-10-01
2180,"display, image, image display, apparatus, method",3.714,-3.056,2025-10-01
1635,"transport, transport apparatus, apparatus, method, apparatus transport",2.773,-3.06,2025-10-01
2305,"braided, braiding, method, methods, braid",2.197,-3.073,2025-10-01
1719,"shovel, shovel shovel, control, method, method controlling",2.079,-3.075,2025-10-01
611,"polishing, chemical, mechanical, chemical mechanical, mechanical polishing",3.714,-3.077,2025-10-01
189,"pallet, pallet pallet, palletizer, method, assembly",2.773,-3.08,2025-10-01
2030,"transmission, power, power transmission, transmission device, device",2.197,-3.088,2025-10-01
1476,"methods, compositions, immune, compositions methods, method",3.178,-3.093,2025-10-01
870,"cells, stem, stem cells, cell, methods",3.689,-3.108,2025-10-01
281,"shaft, coupling, flexible, shaft coupling, hollow",2.996,-3.111,2025-10-01
2207,"beam, recovery, failure, beam failure, failure recovery",3.367,-3.112,2025-10-01
2271,"medication, method, prescription, apparatus, device",3.219,-3.112,2025-10-01
1028,"dispenser, fluid dispenser, fluid, paper, paper dispenser",3.258,-3.113,2025-10-01
414,"focus, method, apparatus, focusing, camera",2.639,-3.113,2025-10-01
1061,"notification, method, response, providing, notifications",3.526,-3.114,2025-10-01
572,"water, treatment, waste, apparatus, method",3.401,-3.114,2025-10-01
441,"waveguide, optical, optical waveguide, method, planar waveguide",3.555,-3.115,2025-10-01
684,"catalyst, process, method, using, preparation",3.807,-3.116,2025-10-01
961,"sliding, slider, slide, method, member",2.485,-3.122,2025-10-01
591,"level, voltage, circuit, shifter, level shifter",2.565,-3.123,2025-10-01
2380,"pcie, express, pci, method, interface",2.485,-3.128,2025-10-01
179,"energy, absorbing, energy absorbing, impact, structure",2.197,-3.129,2025-10-01
1433,"depth, method, image, apparatus, using",3.296,-3.138,2025-10-01
1038,"shift, register, shift register, display, circuit",2.708,-3.141,2025-10-01
1461,"retransmission, method, data, apparatus, data retransmission",1.946,-3.145,2025-10-01
260,"pressure, blood, blood pressure, apparatus, measuring",3.219,-3.151,2025-10-01
524,"fan, cooling, motor, blade, cooling fan",2.639,-3.155,2025-10-01
224,"tire, pneumatic, vehicle, pneumatic tire, method",3.219,-3.157,2025-10-01
2396,"display, device, display device, having, device having",2.565,-3.163,2025-10-01
1894,"light, organic, light emitting, emitting, display",3.611,-3.17,2025-10-01
900,"oled, display, oled display, having, display having",2.833,-3.171,2025-10-01
1814,"display, foldable, foldable display, device, method",3.045,-3.173,2025-10-01
1137,"transaction, processing, method, transactions, methods",3.219,-3.173,2025-10-01
1370,"ultraviolet, light, extreme, source, light source",2.079,-3.18,2025-10-01
946,"mask, method, hard, device, fabrication",3.258,-3.184,2025-10-01
1397,"light, light emitting, emitting, emitting diode, diode",3.332,-3.184,2025-10-01
148,"microfluidic, devices, microfluidic devices, fluid, methods",3.807,-3.201,2025-10-01
13,"stapler, staple, staples, staple remover, remover",3.738,-3.203,2025-10-01
48,"jewelry, clasp, jewelry clasp, jewelry jewelry, clasp jewelry",1.792,-3.205,2025-10-01
339,"seat, seat belt, belt, seatbelt, buckle",2.079,-3.205,2025-10-01
883,"scintillator, radiation, panel, scintillator panel, scintillation",2.197,-3.208,2025-10-01
80,"wiper, windshield wiper, windshield, device, blade",3.135,-3.212,2025-10-01
911,"lighting, device, illumination, apparatus, illuminating",2.303,-3.224,2025-10-01
2020,"battery, electrolyte, nonaqueous, secondary, nonaqueous electrolyte",1.792,-3.23,2025-10-01
1063,"data, stream, method, streams, data stream",2.197,-3.231,2025-10-01
