cluster_id,auto_label,last_log_count,extrapolated_growth_5yr,last_date
1574,"turbine, blade, turbine blade, method, gas turbine",4.078,-1.607,2025-10-01
734,"electronic, device, electronic device, device electronic, apparatus",4.543,-1.611,2025-10-01
798,"paging, apparatus, method apparatus, method, wireless",3.689,-1.612,2025-10-01
2337,"vehicle, platooning, method, vehicles, platoon",1.946,-1.619,2025-10-01
415,"lighting, device, motor, light, lighting device",3.611,-1.619,2025-10-01
337,"pillow, cushion, method, supporting, head",2.565,-1.621,2025-10-01
1907,"bioreactor, use, bioreactors, methods, method",2.996,-1.623,2025-10-01
613,"wafer, method, semiconductor, wafers, processing",4.718,-1.624,2025-10-01
239,"image, solid state, state, solid, state image",3.497,-1.633,2025-10-01
580,"capacitor, method, electrolytic, electrolytic capacitor, solid",3.258,-1.637,2025-10-01
660,"cancer, breast, methods, breast cancer, prostate",3.045,-1.64,2025-10-01
342,"truck, cargo, bed, truck bed, extender",3.135,-1.646,2025-10-01
1350,"wireless, terminal, communication, wireless terminal, method",3.091,-1.648,2025-10-01
1375,"avatar, virtual, method, virtual universe, universe",3.258,-1.648,2025-10-01
385,"vehicle, control, method, controlling, speed",3.401,-1.65,2025-10-01
46,"soybean, soybean cultivar, cultivar, variety, soybean variety",3.367,-1.655,2025-10-01
862,"graphics, rendering, method, pipeline, processing",3.178,-1.655,2025-10-01
1817,"display, eye, near eye, near, eye display",2.565,-1.665,2025-10-01
500,"air, conditioning, air conditioning, conditioner, air conditioner",2.485,-1.666,2025-10-01
50,"circuit, breaker, circuit breaker, power, mechanism",3.497,-1.668,2025-10-01
929,"encryption, method, apparatus, key, encryption decryption",5.011,-1.678,2025-10-01
754,"infusion, device, infusion device, drug, pump",3.045,-1.686,2025-10-01
630,"method, forming, contact, method forming, conductive",4.025,-1.69,2025-10-01
1108,"cosmetic, composition, compositions, personal, cosmetic composition",2.996,-1.694,2025-10-01
552,"remote, control, remote control, method, monitoring",2.944,-1.696,2025-10-01
1340,"semiconductor, package, semiconductor package, method, stacked",3.611,-1.698,2025-10-01
122,"pedal, adjustable, adjustable pedal, assembly, pedal assembly",3.178,-1.701,2025-10-01
228,"massaging, massage, device, apparatus, massage device",3.638,-1.705,2025-10-01
2241,"obstacle, obstacle detection, method, detection, device",2.303,-1.706,2025-10-01
588,"amplifier, circuit, power, power amplifier, frequency",4.673,-1.714,2025-10-01
728,"resist, resist composition, composition, positive, positive resist",3.091,-1.716,2025-10-01
1296,"circuit, board, circuit board, method, manufacturing",2.708,-1.724,2025-10-01
2425,"uplink, grant, grant free, free, transmission",2.639,-1.729,2025-10-01
2289,"network, slice, network slice, method, slicing",3.664,-1.74,2025-10-01
2296,"storage, device, storage device, device storage, data",3.178,-1.742,2025-10-01
778,"centrifuge, centrifugal, rotor, having, centrifuge rotor",2.944,-1.744,2025-10-01
74,"memory, ferroelectric, ferroelectric memory, method, memory device",2.773,-1.748,2025-10-01
1281,"battery, cooling, thermal, method, manufacturing",4.143,-1.749,2025-10-01
758,"belt, conveyor, conveyor belt, belt conveyor, belts",2.773,-1.754,2025-10-01
2080,"learning, machine, machine learning, data, predictive",4.691,-1.759,2025-10-01
1407,"drag, reducing, vehicle, method, drag reducing",3.219,-1.759,2025-10-01
1440,"disposal, waste, waste disposal, medical, medical waste",3.584,-1.762,2025-10-01
1729,"club, golf, golf club, adjustable, assembly",3.584,-1.762,2025-10-01
1977,"coverage, method, wireless, communication, networks",1.792,-1.772,2025-10-01
480,"apparatus, image, sheet, forming apparatus, image forming",3.664,-1.782,2025-10-01
972,"apparatus, fixing, image, image forming, forming",2.833,-1.782,2025-10-01
561,"digital, analog, converter, analog digital, digital converter",4.317,-1.791,2025-10-01
1769,"machine, electric, electric machine, electrical, machine electric",2.708,-1.797,2025-10-01
553,"flip, flop, flip flop, circuit, flop circuit",0.693,-1.797,2025-10-01
1091,"sleep, sleep apnea, apnea, method, methods",2.303,-1.807,2025-10-01
2013,"bicycle, control, bicycle control, device, motor",2.565,-1.807,2025-10-01
1005,"quantum, method, quantum information, information processing, processing",5.273,-1.808,2025-10-01
1303,"housing, electronic, device, electronic device, portable",2.398,-1.808,2025-10-01
640,"gps, method, receiver, satellite, positioning",3.091,-1.811,2025-10-01
467,"image, compression, method, image compression, data",2.303,-1.811,2025-10-01
1017,"folding, foldable, collapsible, machine, structure",2.996,-1.819,2025-10-01
1055,"power, vehicle, supply, power supply, apparatus",3.638,-1.819,2025-10-01
1117,"optical, semiconductor, device, method, optical semiconductor",3.912,-1.823,2025-10-01
2108,"atrial, left, left atrial, atrial appendage, appendage",2.079,-1.827,2025-10-01
2127,"inertial, measurement, inertial measurement, unit, measurement unit",2.833,-1.829,2025-10-01
1198,"display, vehicle, device, vehicle display, display device",4.143,-1.83,2025-10-01
549,"etching, method, etch, semiconductor, etch method",4.29,-1.831,2025-10-01
1111,"stroller, foldable, baby, stroller stroller, collapsible",1.609,-1.832,2025-10-01
1844,"tray, tray table, table, tray tray, having",2.996,-1.833,2025-10-01
412,"zoom, lens, zoom lens, lens zoom, camera",2.833,-1.844,2025-10-01
1691,"pest, control, pest control, method, composition",3.761,-1.849,2025-10-01
564,"laminate, laminated, apparatus, process, laminating",3.912,-1.855,2025-10-01
1045,"apparatus, image, image forming, forming, forming apparatus",2.565,-1.861,2025-10-01
44,"gyroscope, gyro, method, laser, ring laser",2.833,-1.863,2025-10-01
709,"memory, semiconductor, device, semiconductor memory, memory device",4.043,-1.87,2025-10-01
525,"dispensing, device, liquid, dispensing device, apparatus",3.135,-1.873,2025-10-01
2314,"process, robotic, automation, process automation, robotic process",1.609,-1.881,2025-10-01
615,"silicon, silicon carbide, carbide, method, sic",3.871,-1.881,2025-10-01
76,"fuel, fuel cell, cell, polymer, electrolyte",2.944,-1.887,2025-10-01
914,"optical, method, element, optical element, device",2.944,-1.893,2025-10-01
90,"stringed, instrument, musical, stringed musical, musical instrument",2.079,-1.893,2025-10-01
1687,"heat, pump, heat pump, pump heat, method",3.367,-1.897,2025-10-01
270,"liquid, ejecting, method, ejection, liquid ejecting",2.398,-1.898,2025-10-01
132,"connector, electrical, electrical connector, having, connector having",6.016,-1.898,2025-10-01
407,"microscope, scanning, confocal, laser, scanning microscope",3.689,-1.903,2025-10-01
977,"display, light, light emitting, emitting, device",4.644,-1.904,2025-10-01
136,"helmet, protective, sports, helmet protective, headguard",3.332,-1.907,2025-10-01
578,"aluminum, steel, method, alloy, high",3.219,-1.907,2025-10-01
1184,"vehicle, vehicle vehicle, vehicle automobile, vehicle motor, leisure vehicle",3.466,-1.912,2025-10-01
2279,"pose, pose estimation, estimation, systems, methods",2.485,-1.916,2025-10-01
392,"mixing, apparatus, mixing apparatus, device, fluid",3.466,-1.92,2025-10-01
928,"security, method, apparatus, method apparatus, security method",3.135,-1.923,2025-10-01
41,"hologram, holographic, method, apparatus, recording",3.738,-1.926,2025-10-01
761,"paint, method, painting, automotive, process",2.197,-1.933,2025-10-01
1015,"bracket, mounting, mounting bracket, support, bracket assembly",3.135,-1.936,2025-10-01
652,"method, money, device, currency, banknotes",1.386,-1.936,2025-10-01
3,"esd, protection, esd protection, circuit, method",2.944,-1.936,2025-10-01
8,"solar, method, photovoltaic, module, cell",5.442,-1.94,2025-10-01
2394,"metasurfaces, metasurface, optical, tunable, light",2.565,-1.941,2025-10-01
39,"fence, post, fence post, method, fencing",3.045,-1.941,2025-10-01
888,"golf, golf club, club, head, club head",2.197,-1.941,2025-10-01
730,"image, pickup, image pickup, apparatus, pickup apparatus",3.401,-1.943,2025-10-01
1782,"antibodies, thereof, methods, uses, anti",5.811,-1.949,2025-10-01
2325,"pixel, display, driving, circuit, method",4.344,-1.958,2025-10-01
476,"sewing, machine, sewing machine, embroidery, device",2.773,-1.958,2025-10-01
2357,"chroma, coding, prediction, intra, video",2.89,-1.958,2025-10-01
1646,"hyperspectral, imaging, multispectral, method, hyperspectral imaging",2.833,-1.962,2025-10-01
1763,"substrate, component, electronic, built, method",4.673,-1.964,2025-10-01
543,"gas, sensor, gas sensor, sensor gas, method",3.829,-1.968,2025-10-01
2073,"phase, shifter, phase shifter, circuit, shifting",3.178,-1.969,2025-10-01
535,"oscillator, controlled, circuit, voltage, voltage controlled",3.367,-1.971,2025-10-01
983,"refrigerator, refrigerator refrigerator, refrigerator having, having, beverage",3.738,-1.979,2025-10-01
63,"alignment, method, apparatus, device, aligning",2.89,-1.981,2025-10-01
1975,"conversational, conversation, agent, systems, conversational agent",4.078,-1.982,2025-10-01
1523,"scaffold, scaffolds, tissue, method, thereof",2.639,-1.987,2025-10-01
72,"elevator, control, elevator elevator, speed, device",4.007,-1.991,2025-10-01
242,"tissue, method, apparatus, method apparatus, temporarily",3.738,-1.991,2025-10-01
737,"sand, method, sanding, apparatus, sand screen",2.398,-1.992,2025-10-01
1156,"recommendations, method, filtering, collaborative, collaborative filtering",4.111,-1.996,2025-10-01
1571,"cooling, liquid, device, method, cooling device",5.412,-1.997,2025-10-01
144,"box, electrical, connection, junction, connection box",2.944,-2.0,2025-10-01
1237,"image, sensor, image sensor, sensor image, pixel",4.575,-2.001,2025-10-01
383,"alarm, emergency, method, location, alert",2.773,-2.001,2025-10-01
782,"temperature, control, temperature control, apparatus, method",2.944,-2.002,2025-10-01
408,"eye, apparatus, method, tracking, method apparatus",4.143,-2.008,2025-10-01
1194,"dialysis, peritoneal, method, peritoneal dialysis, having",3.714,-2.009,2025-10-01
336,"inflatable, device, apparatus, device inflatable, inflatable device",2.944,-2.011,2025-10-01
1985,"display, display apparatus, apparatus, apparatus display, prism module",4.644,-2.012,2025-10-01
469,"compressor, method, rotary, air, displacement",4.394,-2.013,2025-10-01
303,"torque, control, method, transmitting, torque transmitting",2.833,-2.016,2025-10-01
170,"sterilizing, sterilization, method, apparatus, method sterilizing",3.219,-2.016,2025-10-01
1173,"tamper, tamper resistant, resistant, resistant module, module",2.485,-2.017,2025-10-01
391,"magnetic, resonance, magnetic resonance, method, apparatus",4.477,-2.024,2025-10-01
916,"diverter, faucet, water, hot water, assembly",2.303,-2.027,2025-10-01
1786,"interference, method, wireless, interference cancellation, communication",4.111,-2.03,2025-10-01
904,"hitch, trailer, trailer hitch, assembly, hitch trailer",4.304,-2.033,2025-10-01
2043,"semiconductor, structure, semiconductor structure, structure semiconductor, semiconductor constructions",2.773,-2.034,2025-10-01
1924,"dental, method, manufacturing, restoration, model",4.868,-2.034,2025-10-01
550,"lithium, battery, secondary, electrode, material",2.639,-2.034,2025-10-01
294,"electroluminescent, organic, organic electroluminescent, device, electroluminescent device",4.29,-2.039,2025-10-01
379,"theft, anti, anti theft, vehicle, device",2.398,-2.047,2025-10-01
1016,"canopy, collapsible, tent, shelter, portable",2.708,-2.049,2025-10-01
1633,"luminaire, led, lighting, luminaires, illumination",2.565,-2.052,2025-10-01
2382,"estimation, method, device, estimating, state",2.89,-2.052,2025-10-01
95,"shock, shock absorber, absorber, absorber shock, mount",3.664,-2.054,2025-10-01
951,"duplex, method, communication, time, duplexer",4.111,-2.057,2025-10-01
1285,"nasal, device, devices, nasal dilator, dilator",2.708,-2.06,2025-10-01
380,"occupant, vehicle, protection, occupant protection, device",3.434,-2.064,2025-10-01
784,"method, documents, digital, security, signature",2.89,-2.064,2025-10-01
2216,"machine, work, work machine, machine work, working machine",3.296,-2.067,2025-10-01
2098,"robot, robot robot, care, care robot, segment",2.079,-2.069,2025-10-01
1075,"workflow, method, management, workflow management, workflow method",3.135,-2.077,2025-10-01
173,"agricultural, harvester, harvesting, combine, crop",5.263,-2.084,2025-10-01
397,"ray, apparatus, source, ray source, detector",4.477,-2.087,2025-10-01
941,"radio, method, communication, station, base",3.091,-2.09,2025-10-01
219,"battery, pack, battery pack, pack battery, battery package",2.89,-2.091,2025-10-01
1050,"lighting, apparatus, control, lighting control, methods",2.398,-2.095,2025-10-01
1732,"suppressor, firearm, firearm suppressor, suppressor firearm, silencer",2.639,-2.101,2025-10-01
187,"apparatus, method, music, musical, performance",1.946,-2.104,2025-10-01
1727,"wearable, device, bracelet, watch, wearable computing",4.174,-2.105,2025-10-01
1120,"cannabinoid, receptor, cannabinoid receptor, modulators, receptor modulators",3.784,-2.105,2025-10-01
1152,"virtual, virtual machine, machine, method, virtualization",2.303,-2.105,2025-10-01
1550,"collision, avoidance, collision avoidance, vehicle, method",3.497,-2.106,2025-10-01
1110,"anchor, using, surface, anchoring, method",3.332,-2.111,2025-10-01
1770,"motor, apparatus, control, motor control, controlling",2.197,-2.116,2025-10-01
512,"cryogenic, liquid, storage, device, method",3.871,-2.117,2025-10-01
403,"infrared, detector, sensor, method, infrared radiation",2.708,-2.122,2025-10-01
970,"film, transistor, film transistor, array, transistor array",3.401,-2.123,2025-10-01
131,"seal, turbine, gas, gas turbine, method",1.946,-2.127,2025-10-01
656,"satellite, communication, method, satellite communication, network",3.761,-2.129,2025-10-01
200,"endoscope, endoscope endoscope, variable, endoscopic, apparatus",4.956,-2.133,2025-10-01
1311,"storage, energy, energy storage, device, storage device",4.234,-2.133,2025-10-01
1400,"lighting, control, method, light, lighting method",4.489,-2.136,2025-10-01
1475,"beamforming, method, transmit, apparatus, method beamforming",4.673,-2.138,2025-10-01
22,"welding, method, apparatus, welding apparatus, laser",4.7,-2.144,2025-10-01
164,"navigation, apparatus, method, navigation apparatus, map",3.045,-2.145,2025-10-01
1783,"power, supply, uninterruptible power, uninterruptible, power supply",2.079,-2.149,2025-10-01
2250,"display, method, device, compensation, gamma",2.639,-2.153,2025-10-01
536,"turbine, gas, gas turbine, cooling, method",2.485,-2.153,2025-10-01
2009,"ray, tracing, ray tracing, method, apparatus",2.89,-2.153,2025-10-01
569,"ceramic, method, composition, producing, dielectric",3.135,-2.153,2025-10-01
1937,"drilling, method, directional, directional drilling, drill",4.159,-2.154,2025-10-01
905,"cargo, vehicle, rack, storage, vehicle storage",3.332,-2.155,2025-10-01
2160,"milling, machine, milling machine, method, material",2.197,-2.16,2025-10-01
2225,"therapy, method, photodynamic therapy, photodynamic, phototherapy",2.565,-2.161,2025-10-01
1524,"vehicle, electric, electric vehicle, vehicle electric, equipment",2.303,-2.163,2025-10-01
532,"heat, heat exchanger, exchanger, tube, tube heat",2.996,-2.168,2025-10-01
2224,"fluorescence, method, fluorescent, methods, image",2.485,-2.171,2025-10-01
621,"dielectric, method, layer, constant, dielectric constant",2.303,-2.172,2025-10-01
759,"furniture, furniture furniture, method, systems, post beam",3.219,-2.173,2025-10-01
1490,"liquid, ejecting, apparatus, ejection, ejecting apparatus",3.638,-2.174,2025-10-01
880,"wireless, communication, wireless communication, method, apparatus",2.996,-2.176,2025-10-01
1644,"workpiece, apparatus, method, workpieces, path",3.367,-2.178,2025-10-01
33,"radar, apparatus, radar apparatus, vehicle, doppler",5.063,-2.185,2025-10-01
1982,"prediction, method, intra, intra prediction, apparatus",3.951,-2.189,2025-10-01
1145,"inflammatory, compounds, treatment, treatment inflammatory, anti",2.565,-2.19,2025-10-01
199,"firearm, firing, device, ammunition, apparatus",4.913,-2.19,2025-10-01
1244,"image, segmentation, method, image segmentation, recognition",3.434,-2.192,2025-10-01
1442,"imaging, device, imaging device, methods, method",2.398,-2.195,2025-10-01
1733,"panel, display, display panel, panel display, screen panel",2.996,-2.196,2025-10-01
713,"nucleic, polypeptide, nucleic acids, polypeptides, acids",2.639,-2.201,2025-10-01
1704,"receiver, signal, transmitter, transmitting, receiving",3.497,-2.206,2025-10-01
79,"method, blasting, apparatus, explosives, blast",2.485,-2.208,2025-10-01
151,"magnetic, recording, magnetic recording, apparatus, recording medium",3.258,-2.21,2025-10-01
364,"board, printed, circuit, circuit board, method",3.526,-2.211,2025-10-01
1101,"film, display, polarizing, plate, polarizing plate",2.833,-2.216,2025-10-01
689,"identification, radio, radio frequency, frequency, frequency identification",3.912,-2.217,2025-10-01
261,"heart, method, stimulation, device, apparatus",3.932,-2.221,2025-10-01
247,"syringe, syringe syringe, method, syringes, hypodermic",3.664,-2.227,2025-10-01
2360,"vacuum, refrigerator, vacuum adiabatic, adiabatic, adiabatic body",1.386,-2.232,2025-10-01
506,"pressure, sensor, pressure sensor, device, control",3.784,-2.234,2025-10-01
2262,"air, conditioning, air conditioning, vehicle, method",3.829,-2.243,2025-10-01
1243,"lens, intraocular, intraocular lens, accommodating intraocular, accommodating",2.996,-2.243,2025-10-01
1945,"virtual, reality, virtual reality, method, objects",3.714,-2.249,2025-10-01
331,"mounting, apparatus, bracket, device, electronic",3.497,-2.251,2025-10-01
1416,"lane, method, road, road lane, apparatus",3.689,-2.251,2025-10-01
2243,"separator, electrochemical, electrode, comprising, element",2.485,-2.257,2025-10-01
2320,"processing, method, device, processing device, program",2.303,-2.257,2025-10-01
1988,"polar, method, code, polar code, codes",2.708,-2.257,2025-10-01
378,"robot, method, control, robot robot, apparatus",4.575,-2.26,2025-10-01
644,"field, effect, field effect, transistor, effect transistor",3.434,-2.261,2025-10-01
2129,"phishing, methods, detection, systems, phishing attacks",2.398,-2.263,2025-10-01
2139,"pcie, express, pci express, pci, chip",2.079,-2.265,2025-10-01
168,"biopsy, method, needle, biopsy needle, forceps",2.485,-2.269,2025-10-01
839,"dust, vacuum, cleaner, cyclone dust, cyclone",2.398,-2.271,2025-10-01
396,"apparatus, ct, tomography, method, method apparatus",3.401,-2.273,2025-10-01
2083,"graph, data, method, processing, database",3.638,-2.276,2025-10-01
627,"loop, phase, locked, locked loop, phase locked",2.708,-2.276,2025-10-01
2258,"air, quality, air quality, monitoring, pollution",2.303,-2.283,2025-10-01
1102,"method, defect, apparatus, defects, detection",2.996,-2.285,2025-10-01
1690,"probiotic, lactobacillus, use, strains, composition",4.605,-2.286,2025-10-01
2235,"optical, device, optical device, device optical, display",2.996,-2.291,2025-10-01
527,"dispenser, product, dispensing, method, dispenser dispenser",2.773,-2.295,2025-10-01
386,"membrane, membranes, method, composite, producing",4.078,-2.297,2025-10-01
101,"ion, beam, ion beam, method, apparatus",3.638,-2.302,2025-10-01
773,"filter, color, color filter, method, filter color",2.565,-2.311,2025-10-01
857,"scanner, scanning, apparatus, method, scan",3.714,-2.314,2025-10-01
1467,"video, method, apparatus, transmitting, transmission",4.564,-2.315,2025-10-01
358,"measuring, device, method, measuring device, measurement",3.85,-2.317,2025-10-01
515,"refrigeration, refrigerant, device, evaporative, cooling",3.784,-2.319,2025-10-01
1617,"battery, separator, secondary, secondary battery, non",2.89,-2.32,2025-10-01
2344,"storage, thermal, energy, energy storage, heat",2.398,-2.321,2025-10-01
137,"shielding, emi, electromagnetic, shield, emi shielding",3.526,-2.323,2025-10-01
126,"wound, dressing, wound dressing, method, wounds",3.367,-2.324,2025-10-01
1943,"aerogel, aerogels, method, silica, silica aerogel",2.773,-2.324,2025-10-01
702,"cache, method, data, memory, caching",4.382,-2.325,2025-10-01
851,"clip, method, clip clip, apparatus, clips",2.996,-2.328,2025-10-01
227,"shoe, sole, shoes, method, outsole",5.231,-2.334,2025-10-01
71,"glove, gloves, protective, powder free, free",2.565,-2.334,2025-10-01
435,"optoelectronic, opto, device, circuit, method",3.401,-2.343,2025-10-01
806,"monitoring, method, method monitoring, monitoring method, device",3.761,-2.344,2025-10-01
237,"method, apparatus, physiological, body, method apparatus",3.738,-2.345,2025-10-01
2383,"semiconductor, circuit, integrated, integrated circuit, semiconductor integrated",2.079,-2.349,2025-10-01
1496,"anomaly, detection, anomaly detection, detecting, systems",4.477,-2.35,2025-10-01
1961,"fan, flow, device, flow fan, fan fan",4.29,-2.351,2025-10-01
2292,"communication, sidelink, method, wireless communication, wireless",4.71,-2.359,2025-10-01
1853,"vehicle, control, vehicle control, control vehicle, method",4.174,-2.36,2025-10-01
277,"washing, washing machine, machine, device, washer",4.554,-2.361,2025-10-01
389,"noise, apparatus, method, reducing, reduction",4.025,-2.361,2025-10-01
1958,"detection, method, device, detection device, detection method",3.135,-2.365,2025-10-01
298,"inductor, method, manufacturing, method manufacturing, high",3.85,-2.367,2025-10-01
1306,"seat, vehicle, chair, vehicle seat, device",4.673,-2.37,2025-10-01
20,"docking, computer, station, docking station, portable",3.258,-2.371,2025-10-01
1286,"gesture, method, gestures, apparatus, method apparatus",3.638,-2.38,2025-10-01
284,"mower, lawn, lawn mower, unit, cutting",3.296,-2.38,2025-10-01
2236,"tiles, tile, leveling, method, aligning",1.946,-2.381,2025-10-01
1655,"sheath, method, expandable, use, access",2.944,-2.381,2025-10-01
353,"keyboard, device, keypad, key, computer",3.258,-2.388,2025-10-01
752,"tailgate, truck, assembly, tailgate assembly, apparatus",2.197,-2.392,2025-10-01
969,"display, method, device, display device, manufacturing",4.394,-2.396,2025-10-01
451,"display, panel, flat panel, flat, panel display",4.443,-2.404,2025-10-01
894,"parking, method, vehicle, device, assist",3.989,-2.404,2025-10-01
1878,"reception, discontinuous, discontinuous reception, method, wireless",2.485,-2.406,2025-10-01
273,"article, articles, apparatus, device, like",2.944,-2.41,2025-10-01
313,"suspension, vehicle, wheel, wheel suspension, vehicles",4.263,-2.417,2025-10-01
1678,"exhaust, gas, exhaust gas, device, method",3.97,-2.418,2025-10-01
248,"needle, method, apparatus, needles, medical",3.178,-2.418,2025-10-01
1736,"blower, apparatus, air, blower apparatus, method",2.565,-2.419,2025-10-01
304,"hanger, garment, garment hanger, hanging, hanger hanger",2.639,-2.423,2025-10-01
661,"treatment, disorders, method, treating, disorder",4.127,-2.425,2025-10-01
2031,"adhesive, composition, adhesive composition, adhesives, pressure",4.477,-2.427,2025-10-01
605,"method, handoff, communication, handover, mobile",4.369,-2.436,2025-10-01
165,"sensor, capacitive, sensor capacitive, pressure sensor, pressure",3.401,-2.438,2025-10-01
1498,"ultrasound, apparatus, method, ultrasonic, imaging",5.572,-2.438,2025-10-01
1525,"biological, apparatus, sample, method, biological sample",3.045,-2.44,2025-10-01
365,"metals, recovery, method, ores, metal",2.485,-2.442,2025-10-01
1329,"cochlear, implant, cochlear implant, electrode, electrode array",1.946,-2.447,2025-10-01
2423,"access, control, management, access control, method",3.829,-2.447,2025-10-01
324,"conveyor, conveying, device, material, apparatus",3.664,-2.448,2025-10-01
5,"watermark, method, digital, apparatus, method apparatus",2.996,-2.448,2025-10-01
1890,"memory, dimensional, device, memory device, semiconductor",4.22,-2.449,2025-10-01
681,"adenovirus, recombinant, adenoviral, vectors, methods",2.398,-2.449,2025-10-01
1439,"defibrillator, defibrillation, method, external, defibrillators",2.639,-2.45,2025-10-01
2358,"video, decoding, method, apparatus, encoding",3.296,-2.45,2025-10-01
251,"prosthesis, bone, device, plate, method",5.826,-2.452,2025-10-01
1649,"domain, method, dns, systems, resolution",3.135,-2.456,2025-10-01
593,"user, interface, user interface, data, method",2.833,-2.457,2025-10-01
1604,"apparatus, paper, sheet, conveying, printing",3.367,-2.458,2025-10-01
706,"method, retrieval, information, search, document",5.826,-2.46,2025-10-01
160,"applicator, method, applicator applicator, having, fluid",3.135,-2.466,2025-10-01
2338,"exosomes, derived, method, exosome, derived exosomes",2.565,-2.466,2025-10-01
836,"device, feedback, tactile, haptic, haptic feedback",3.434,-2.473,2025-10-01
2284,"radio, module, frequency, radio frequency, frequency module",2.485,-2.474,2025-10-01
367,"abrasive, tool, abrasive tool, process, disc",2.398,-2.476,2025-10-01
1185,"quantum, dot, quantum dot, method, quantum dots",3.85,-2.479,2025-10-01
1731,"information, terminal, processing, information processing, method",2.565,-2.482,2025-10-01
1213,"battery, module, pack, battery pack, battery module",3.091,-2.483,2025-10-01
539,"heating, heat, apparatus, device, method",3.97,-2.483,2025-10-01
2264,"vehicle, management, thermal, thermal management, vehicle thermal",2.944,-2.484,2025-10-01
1652,"energy, harvesting, energy harvesting, method, apparatus",3.219,-2.486,2025-10-01
1744,"treatment, device, method, treatment device, therapy",2.773,-2.493,2025-10-01
1916,"boron, nitride, boron nitride, method, containing",2.996,-2.495,2025-10-01
1728,"nanopore, sequencing, using, nanopore sequencing, device",2.639,-2.499,2025-10-01
440,"display, apparatus, device, control, display control",4.477,-2.502,2025-10-01
274,"downhole, method, apparatus, tool, downhole tool",3.638,-2.503,2025-10-01
